<?xml version="1.0" encoding="UTF-8"?>
<mirror xmlns="http://www.devefx.org/schema/mirror"
	xmlns:xsi="http://www.w3.org/2001/XMLSchema-instance"
	xsi:schemaLocation="http://www.devefx.org/schema/mirror mirror-1.0.xsd">
	
	<!-- 引入属性文件 -->
	<property-file resource="setting.properties"/>
	
	<bean id="testBean" class="test.TestBean">
		<constructor-arg ref="dataSource"/>
		<constructor-arg>
			<list>
				<value>a</value>
				<value>b</value>
			</list>
		</constructor-arg>
		<constructor-arg>
			<map>
				<entry key="a" value="1"/>
				<entry key="b" value-ref="dataSource"/>
			</map>
		</constructor-arg>
		<constructor-arg value="名称"/>
		
		<property name="dataSource" ref="dataSource" />
	</bean>
	
	<!-- 配置数据源 -->
	<bean id="dataSource" class="com.alibaba.druid.pool.DruidDataSource" init-method="init">
		<!-- 连接信息 -->
		<property name="url" value="${jdbc.url}"/>
		<property name="username" value="${jdbc.user}"/>
		<property name="password" value="${jdbc.password}"/>
		<!-- 初始化设置 -->
		<property name="initialSize" value="1" />
		<property name="maxActive" value="20" />
		<property name="minIdle" value="1" />
		<property name="maxWait" value="60000" />
		<!-- 验证设置 -->
		<property name="validationQuery" value="${jdbc.validationQuery}"/>
		<property name="testOnBorrow" value="true"/>
		<property name="testOnReturn" value="true" />
		<property name="testWhileIdle" value="true" />
	</bean>
	
	<!-- <dataSource type="sqlmap.engine.datasource.MultiDataSource">
		<property name="readDataSource">
			<list>
				<ref bean=""/>
			</list>
		</property>
		<property name="writeDataSource">
			<list>
				
			</list>
		</property>
		<property name=""/>
	</dataSource> -->
	
	<bean class="test.TestBean">
		<constructor-arg ref="dataSource"/>
		<constructor-arg>
			<list>
				<value>1</value>
				<value>2</value>
			</list>
		</constructor-arg>
		<constructor-arg>
			<map>
				<entry key="a" value="1"/>
				<entry key="b" value-ref="dataSource"/>
				<entry key-ref="dataSource" value="这是数据源"/>
			</map>
		</constructor-arg>
		<constructor-arg value="文章"/>
		<property name="dataSource" ref="dataSource" />
	</bean>
	
	<setting dataSource="dataSource1"/>
	
</mirror>